{
  "artifact": "qubo",
  "artifact_schema_version": "1.0",
  "constraints": [
    {
      "capacity": 1,
      "coefficients": [
        1,
        1
      ],
      "encoding": "AT_MOST_ONE_PAIRWISE",
      "name": "one:apps/api-7b8c9d-aaaaa",
      "penalty_pairs": [
        [
          0,
          1
        ]
      ],
      "reduced_capacity": null,
      "reduced_coefficients": [],
      "scale": null,
      "slack_qubits": [],
      "slack_weights": [],
      "variables": [
        0,
        1
      ]
    },
    {
      "capacity": 1,
      "coefficients": [
        1,
        1
      ],
      "encoding": "AT_MOST_ONE_PAIRWISE",
      "name": "one:apps/api-7b8c9d-bbbbb",
      "penalty_pairs": [
        [
          2,
          3
        ]
      ],
      "reduced_capacity": null,
      "reduced_coefficients": [],
      "scale": null,
      "slack_qubits": [],
      "slack_weights": [],
      "variables": [
        2,
        3
      ]
    },
    {
      "capacity": 1,
      "coefficients": [
        1,
        1
      ],
      "encoding": "AT_MOST_ONE_PAIRWISE",
      "name": "one:apps/api-7b8c9d-ccccc",
      "penalty_pairs": [
        [
          4,
          5
        ]
      ],
      "reduced_capacity": null,
      "reduced_coefficients": [],
      "scale": null,
      "slack_qubits": [],
      "slack_weights": [],
      "variables": [
        4,
        5
      ]
    },
    {
      "capacity": 1,
      "coefficients": [
        1,
        1
      ],
      "encoding": "AT_MOST_ONE_PAIRWISE",
      "name": "one:apps/api-7b8c9d-ddddd",
      "penalty_pairs": [
        [
          6,
          7
        ]
      ],
      "reduced_capacity": null,
      "reduced_coefficients": [],
      "scale": null,
      "slack_qubits": [],
      "slack_weights": [],
      "variables": [
        6,
        7
      ]
    },
    {
      "capacity": 2500,
      "coefficients": [
        1000,
        1000,
        1000,
        1000
      ],
      "encoding": "CAPACITY_SLACK",
      "name": "cap:node-big:cpu_millicores",
      "penalty_pairs": [],
      "reduced_capacity": 2,
      "reduced_coefficients": [
        1,
        1,
        1,
        1
      ],
      "scale": 1000,
      "slack_qubits": [
        8,
        9
      ],
      "slack_weights": [
        1,
        1
      ],
      "variables": [
        0,
        2,
        4,
        6
      ]
    },
    {
      "capacity": 8589934592,
      "coefficients": [
        536870912,
        536870912,
        536870912,
        536870912
      ],
      "encoding": "CAPACITY_REDUNDANT",
      "name": "cap:node-big:memory_bytes",
      "penalty_pairs": [],
      "reduced_capacity": null,
      "reduced_coefficients": [],
      "scale": null,
      "slack_qubits": [],
      "slack_weights": [],
      "variables": [
        0,
        2,
        4,
        6
      ]
    },
    {
      "capacity": 110,
      "coefficients": [
        1,
        1,
        1,
        1
      ],
      "encoding": "CAPACITY_REDUNDANT",
      "name": "cap:node-big:pods",
      "penalty_pairs": [],
      "reduced_capacity": null,
      "reduced_coefficients": [],
      "scale": null,
      "slack_qubits": [],
      "slack_weights": [],
      "variables": [
        0,
        2,
        4,
        6
      ]
    },
    {
      "capacity": 1000,
      "coefficients": [
        1000,
        1000,
        1000,
        1000
      ],
      "encoding": "CAPACITY_PAIRWISE_EXACT",
      "name": "cap:node-small:cpu_millicores",
      "penalty_pairs": [
        [
          1,
          3
        ],
        [
          1,
          5
        ],
        [
          1,
          7
        ],
        [
          3,
          5
        ],
        [
          3,
          7
        ],
        [
          5,
          7
        ]
      ],
      "reduced_capacity": null,
      "reduced_coefficients": [],
      "scale": null,
      "slack_qubits": [],
      "slack_weights": [],
      "variables": [
        1,
        3,
        5,
        7
      ]
    },
    {
      "capacity": 4294967296,
      "coefficients": [
        536870912,
        536870912,
        536870912,
        536870912
      ],
      "encoding": "CAPACITY_REDUNDANT",
      "name": "cap:node-small:memory_bytes",
      "penalty_pairs": [],
      "reduced_capacity": null,
      "reduced_coefficients": [],
      "scale": null,
      "slack_qubits": [],
      "slack_weights": [],
      "variables": [
        1,
        3,
        5,
        7
      ]
    },
    {
      "capacity": 110,
      "coefficients": [
        1,
        1,
        1,
        1
      ],
      "encoding": "CAPACITY_REDUNDANT",
      "name": "cap:node-small:pods",
      "penalty_pairs": [],
      "reduced_capacity": null,
      "reduced_coefficients": [],
      "scale": null,
      "slack_qubits": [],
      "slack_weights": [],
      "variables": [
        1,
        3,
        5,
        7
      ]
    }
  ],
  "correctness_evidence": {
    "every_max_assignment_reaches_minimum": true,
    "feasible_energy_exact": true,
    "infeasible_strictly_above_minimum": true,
    "ising_matches_qubo": true,
    "max_feasible_pods": 3,
    "min_energy": -3,
    "min_infeasible_energy": 4,
    "minima_all_feasible_max_cardinality": true,
    "minimum_states": 12,
    "states_enumerated": 1024,
    "valid": true
  },
  "fixture": "scenario_g_triple_capacity",
  "generator": {
    "milestone": "M3",
    "name": "qplace",
    "version": "0.1.0"
  },
  "objective": "minimize -sum(assignment x) + penalties; primary M2 objective (pods placed) only",
  "penalty": 8,
  "penalty_rule": "P = number of assignment variables; any violated term costs >= P",
  "qubo": {
    "constant": 32,
    "linear": [
      {
        "coefficient": -25,
        "i": 0
      },
      {
        "coefficient": -1,
        "i": 1
      },
      {
        "coefficient": -25,
        "i": 2
      },
      {
        "coefficient": -1,
        "i": 3
      },
      {
        "coefficient": -25,
        "i": 4
      },
      {
        "coefficient": -1,
        "i": 5
      },
      {
        "coefficient": -25,
        "i": 6
      },
      {
        "coefficient": -1,
        "i": 7
      },
      {
        "coefficient": -24,
        "i": 8
      },
      {
        "coefficient": -24,
        "i": 9
      }
    ],
    "num_variables": 10,
    "quadratic": [
      {
        "coefficient": 8,
        "i": 0,
        "j": 1
      },
      {
        "coefficient": 16,
        "i": 0,
        "j": 2
      },
      {
        "coefficient": 16,
        "i": 0,
        "j": 4
      },
      {
        "coefficient": 16,
        "i": 0,
        "j": 6
      },
      {
        "coefficient": 16,
        "i": 0,
        "j": 8
      },
      {
        "coefficient": 16,
        "i": 0,
        "j": 9
      },
      {
        "coefficient": 8,
        "i": 1,
        "j": 3
      },
      {
        "coefficient": 8,
        "i": 1,
        "j": 5
      },
      {
        "coefficient": 8,
        "i": 1,
        "j": 7
      },
      {
        "coefficient": 8,
        "i": 2,
        "j": 3
      },
      {
        "coefficient": 16,
        "i": 2,
        "j": 4
      },
      {
        "coefficient": 16,
        "i": 2,
        "j": 6
      },
      {
        "coefficient": 16,
        "i": 2,
        "j": 8
      },
      {
        "coefficient": 16,
        "i": 2,
        "j": 9
      },
      {
        "coefficient": 8,
        "i": 3,
        "j": 5
      },
      {
        "coefficient": 8,
        "i": 3,
        "j": 7
      },
      {
        "coefficient": 8,
        "i": 4,
        "j": 5
      },
      {
        "coefficient": 16,
        "i": 4,
        "j": 6
      },
      {
        "coefficient": 16,
        "i": 4,
        "j": 8
      },
      {
        "coefficient": 16,
        "i": 4,
        "j": 9
      },
      {
        "coefficient": 8,
        "i": 5,
        "j": 7
      },
      {
        "coefficient": 8,
        "i": 6,
        "j": 7
      },
      {
        "coefficient": 16,
        "i": 6,
        "j": 8
      },
      {
        "coefficient": 16,
        "i": 6,
        "j": 9
      },
      {
        "coefficient": 16,
        "i": 8,
        "j": 9
      }
    ]
  },
  "source": {
    "snapshot_id": "m3-scenario-g-triple-capacity",
    "source_sha256": "d2a82a960b2b770cd5111e2f3a553b321992e9113a09fb5ac70c0a94b20b8fe8"
  },
  "status": "SUPPORTED",
  "target_node": "source"
}
