{
  "artifact": "qubo",
  "artifact_schema_version": "1.0",
  "constraints": [
    {
      "capacity": 1,
      "coefficients": [
        1,
        1
      ],
      "encoding": "AT_MOST_ONE_PAIRWISE",
      "name": "one:shop/api-6e5d4c-aaaaa",
      "penalty_pairs": [
        [
          0,
          1
        ]
      ],
      "reduced_capacity": null,
      "reduced_coefficients": [],
      "scale": null,
      "slack_qubits": [],
      "slack_weights": [],
      "variables": [
        0,
        1
      ]
    },
    {
      "capacity": 1,
      "coefficients": [
        1,
        1
      ],
      "encoding": "AT_MOST_ONE_PAIRWISE",
      "name": "one:shop/cache-0",
      "penalty_pairs": [
        [
          2,
          3
        ]
      ],
      "reduced_capacity": null,
      "reduced_coefficients": [],
      "scale": null,
      "slack_qubits": [],
      "slack_weights": [],
      "variables": [
        2,
        3
      ]
    },
    {
      "capacity": 1,
      "coefficients": [
        1,
        1
      ],
      "encoding": "AT_MOST_ONE_PAIRWISE",
      "name": "one:shop/web-5d4c3b-bbbbb",
      "penalty_pairs": [
        [
          4,
          5
        ]
      ],
      "reduced_capacity": null,
      "reduced_coefficients": [],
      "scale": null,
      "slack_qubits": [],
      "slack_weights": [],
      "variables": [
        4,
        5
      ]
    },
    {
      "capacity": 3000,
      "coefficients": [
        800,
        500,
        1000
      ],
      "encoding": "CAPACITY_REDUNDANT",
      "name": "cap:worker-01:cpu_millicores",
      "penalty_pairs": [],
      "reduced_capacity": null,
      "reduced_coefficients": [],
      "scale": null,
      "slack_qubits": [],
      "slack_weights": [],
      "variables": [
        0,
        2,
        4
      ]
    },
    {
      "capacity": 6442450944,
      "coefficients": [
        1073741824,
        3221225472,
        2147483648
      ],
      "encoding": "CAPACITY_REDUNDANT",
      "name": "cap:worker-01:memory_bytes",
      "penalty_pairs": [],
      "reduced_capacity": null,
      "reduced_coefficients": [],
      "scale": null,
      "slack_qubits": [],
      "slack_weights": [],
      "variables": [
        0,
        2,
        4
      ]
    },
    {
      "capacity": 109,
      "coefficients": [
        1,
        1,
        1
      ],
      "encoding": "CAPACITY_REDUNDANT",
      "name": "cap:worker-01:pods",
      "penalty_pairs": [],
      "reduced_capacity": null,
      "reduced_coefficients": [],
      "scale": null,
      "slack_qubits": [],
      "slack_weights": [],
      "variables": [
        0,
        2,
        4
      ]
    },
    {
      "capacity": 4000,
      "coefficients": [
        800,
        500,
        1000
      ],
      "encoding": "CAPACITY_REDUNDANT",
      "name": "cap:worker-02:cpu_millicores",
      "penalty_pairs": [],
      "reduced_capacity": null,
      "reduced_coefficients": [],
      "scale": null,
      "slack_qubits": [],
      "slack_weights": [],
      "variables": [
        1,
        3,
        5
      ]
    },
    {
      "capacity": 8589934592,
      "coefficients": [
        1073741824,
        3221225472,
        2147483648
      ],
      "encoding": "CAPACITY_REDUNDANT",
      "name": "cap:worker-02:memory_bytes",
      "penalty_pairs": [],
      "reduced_capacity": null,
      "reduced_coefficients": [],
      "scale": null,
      "slack_qubits": [],
      "slack_weights": [],
      "variables": [
        1,
        3,
        5
      ]
    },
    {
      "capacity": 110,
      "coefficients": [
        1,
        1,
        1
      ],
      "encoding": "CAPACITY_REDUNDANT",
      "name": "cap:worker-02:pods",
      "penalty_pairs": [],
      "reduced_capacity": null,
      "reduced_coefficients": [],
      "scale": null,
      "slack_qubits": [],
      "slack_weights": [],
      "variables": [
        1,
        3,
        5
      ]
    }
  ],
  "correctness_evidence": {
    "every_max_assignment_reaches_minimum": true,
    "feasible_energy_exact": true,
    "infeasible_strictly_above_minimum": true,
    "ising_matches_qubo": true,
    "max_feasible_pods": 3,
    "min_energy": -3,
    "min_infeasible_energy": 2,
    "minima_all_feasible_max_cardinality": true,
    "minimum_states": 8,
    "states_enumerated": 64,
    "valid": true
  },
  "fixture": "scenario_a_feasible",
  "generator": {
    "milestone": "M3",
    "name": "qplace",
    "version": "0.1.0"
  },
  "objective": "minimize -sum(assignment x) + penalties; primary M2 objective (pods placed) only",
  "penalty": 6,
  "penalty_rule": "P = number of assignment variables; any violated term costs >= P",
  "qubo": {
    "constant": 0,
    "linear": [
      {
        "coefficient": -1,
        "i": 0
      },
      {
        "coefficient": -1,
        "i": 1
      },
      {
        "coefficient": -1,
        "i": 2
      },
      {
        "coefficient": -1,
        "i": 3
      },
      {
        "coefficient": -1,
        "i": 4
      },
      {
        "coefficient": -1,
        "i": 5
      }
    ],
    "num_variables": 6,
    "quadratic": [
      {
        "coefficient": 6,
        "i": 0,
        "j": 1
      },
      {
        "coefficient": 6,
        "i": 2,
        "j": 3
      },
      {
        "coefficient": 6,
        "i": 4,
        "j": 5
      }
    ]
  },
  "source": {
    "snapshot_id": "m2-scenario-a-feasible",
    "source_sha256": "c63654c225a1f1ae508046a1f8cde3275e886e82ccc9ba1eafeb51c2a657db47"
  },
  "status": "SUPPORTED",
  "target_node": "worker-03"
}
