{
  "artifact": "qubo",
  "artifact_schema_version": "1.0",
  "constraints": [
    {
      "capacity": 1,
      "coefficients": [
        1,
        1
      ],
      "encoding": "AT_MOST_ONE_PAIRWISE",
      "name": "one:batch/report-28999-xk2lp",
      "penalty_pairs": [
        [
          0,
          1
        ]
      ],
      "reduced_capacity": null,
      "reduced_coefficients": [],
      "scale": null,
      "slack_qubits": [],
      "slack_weights": [],
      "variables": [
        0,
        1
      ]
    },
    {
      "capacity": 1,
      "coefficients": [
        1
      ],
      "encoding": "AT_MOST_ONE_PAIRWISE",
      "name": "one:payments/api-6d5c4b-aaaaa",
      "penalty_pairs": [],
      "reduced_capacity": null,
      "reduced_coefficients": [],
      "scale": null,
      "slack_qubits": [],
      "slack_weights": [],
      "variables": [
        2
      ]
    },
    {
      "capacity": 6300,
      "coefficients": [
        250,
        500
      ],
      "encoding": "CAPACITY_REDUNDANT",
      "name": "cap:worker-01:cpu_millicores",
      "penalty_pairs": [],
      "reduced_capacity": null,
      "reduced_coefficients": [],
      "scale": null,
      "slack_qubits": [],
      "slack_weights": [],
      "variables": [
        0,
        2
      ]
    },
    {
      "capacity": 26843545600,
      "coefficients": [
        536870912,
        1073741824
      ],
      "encoding": "CAPACITY_REDUNDANT",
      "name": "cap:worker-01:memory_bytes",
      "penalty_pairs": [],
      "reduced_capacity": null,
      "reduced_coefficients": [],
      "scale": null,
      "slack_qubits": [],
      "slack_weights": [],
      "variables": [
        0,
        2
      ]
    },
    {
      "capacity": 108,
      "coefficients": [
        1,
        1
      ],
      "encoding": "CAPACITY_REDUNDANT",
      "name": "cap:worker-01:pods",
      "penalty_pairs": [],
      "reduced_capacity": null,
      "reduced_coefficients": [],
      "scale": null,
      "slack_qubits": [],
      "slack_weights": [],
      "variables": [
        0,
        2
      ]
    },
    {
      "capacity": 7800,
      "coefficients": [
        250
      ],
      "encoding": "CAPACITY_REDUNDANT",
      "name": "cap:worker-04:cpu_millicores",
      "penalty_pairs": [],
      "reduced_capacity": null,
      "reduced_coefficients": [],
      "scale": null,
      "slack_qubits": [],
      "slack_weights": [],
      "variables": [
        1
      ]
    },
    {
      "capacity": 32212254720,
      "coefficients": [
        536870912
      ],
      "encoding": "CAPACITY_REDUNDANT",
      "name": "cap:worker-04:memory_bytes",
      "penalty_pairs": [],
      "reduced_capacity": null,
      "reduced_coefficients": [],
      "scale": null,
      "slack_qubits": [],
      "slack_weights": [],
      "variables": [
        1
      ]
    },
    {
      "capacity": 110,
      "coefficients": [
        1
      ],
      "encoding": "CAPACITY_REDUNDANT",
      "name": "cap:worker-04:pods",
      "penalty_pairs": [],
      "reduced_capacity": null,
      "reduced_coefficients": [],
      "scale": null,
      "slack_qubits": [],
      "slack_weights": [],
      "variables": [
        1
      ]
    }
  ],
  "correctness_evidence": {
    "every_max_assignment_reaches_minimum": true,
    "feasible_energy_exact": true,
    "infeasible_strictly_above_minimum": true,
    "ising_matches_qubo": true,
    "max_feasible_pods": 2,
    "min_energy": -2,
    "min_infeasible_energy": 0,
    "minima_all_feasible_max_cardinality": true,
    "minimum_states": 2,
    "states_enumerated": 8,
    "valid": true
  },
  "fixture": "fixture_c_constraints",
  "generator": {
    "milestone": "M3",
    "name": "qplace",
    "version": "0.1.0"
  },
  "objective": "minimize -sum(assignment x) + penalties; primary M2 objective (pods placed) only",
  "penalty": 3,
  "penalty_rule": "P = number of assignment variables; any violated term costs >= P",
  "qubo": {
    "constant": 0,
    "linear": [
      {
        "coefficient": -1,
        "i": 0
      },
      {
        "coefficient": -1,
        "i": 1
      },
      {
        "coefficient": -1,
        "i": 2
      }
    ],
    "num_variables": 3,
    "quadratic": [
      {
        "coefficient": 3,
        "i": 0,
        "j": 1
      }
    ]
  },
  "source": {
    "snapshot_id": "fixture-c-constraints",
    "source_sha256": "6ff5166fd6a7b53a6ea3a6aad8954968fcbd9bfd445865ac0f5e83aa41fa18b0"
  },
  "status": "SUPPORTED",
  "target_node": "worker-03"
}
